<?xml version="1.0" encoding="UTF-8"?>
<DSSV xmlns="http://www.example.org/sinhvien"
      xmlns:xsi="http://www.w3.org/2001/XMLSchema-instance"
      xsi:schemaLocation="http://www.example.org/sinhvien sinhvien.xsd">

  <!-- 5 khoa (TEN chỉ gồm a-z) -->
  <KHOA>
    <MAKHOA>K01</MAKHOA>
    <TEN>cntt</TEN>
  </KHOA>
  <KHOA>
    <MAKHOA>K02</MAKHOA>
    <TEN>qtkd</TEN>
  </KHOA>
  <KHOA>
    <MAKHOA>K03</MAKHOA>
    <TEN>nn</TEN>
  </KHOA>
  <KHOA>
    <MAKHOA>K04</MAKHOA>
    <TEN>kt</TEN>
  </KHOA>
  <KHOA>
    <MAKHOA>K05</MAKHOA>
    <TEN>yt</TEN>
  </KHOA>

  <!-- 5 lop (MALOP tham chiếu MAKHOA) -->
  <LOP>
    <MALOP>L000001</MALOP>
    <TEN>cntt1</TEN>
    <MAKHOA>K01</MAKHOA>
  </LOP>
  <LOP>
    <MALOP>L000002</MALOP>
    <TEN>cntt2</TEN>
    <MAKHOA>K01</MAKHOA>
  </LOP>
  <LOP>
    <MALOP>L000003</MALOP>
    <TEN>qtkd1</TEN>
    <MAKHOA>K02</MAKHOA>
  </LOP>
  <LOP>
    <MALOP>L000004</MALOP>
    <TEN>kt1</TEN>
    <MAKHOA>K04</MAKHOA>
  </LOP>
  <LOP>
    <MALOP>L000005</MALOP>
    <TEN>yt1</TEN>
    <MAKHOA>K05</MAKHOA>
  </LOP>

  <!-- 5 sinh vien (MALOP tham chiếu LOP; SDT đúng định dạng 0xxxxxxxxx) -->
  <SINHVIEN>
    <MSSV>SV0000001</MSSV>
    <HOTEN>Nguyen Van A</HOTEN>
    <EMAIL>a@example.com</EMAIL>
    <DIACHI>Can Tho</DIACHI>
    <SDT>0912345678</SDT>
    <MALOP>L000001</MALOP>
  </SINHVIEN>

  <SINHVIEN>
    <MSSV>SV0000002</MSSV>
    <HOTEN>Tran Thi B</HOTEN>
    <EMAIL>b@example.com</EMAIL>
    <DIACHI>Vinh Long</DIACHI>
    <SDT>0987654321</SDT>
    <MALOP>L000001</MALOP>
  </SINHVIEN>

  <SINHVIEN>
    <MSSV>SV0000003</MSSV>
    <HOTEN>Le Van C</HOTEN>
    <EMAIL>c@example.com</EMAIL>
    <DIACHI>Hau Giang</DIACHI>
    <SDT>0909090909</SDT>
    <MALOP>L000002</MALOP>
  </SINHVIEN>

  <SINHVIEN>
    <MSSV>SV0000004</MSSV>
    <HOTEN>Pham Thi D</HOTEN>
    <EMAIL>d@example.com</EMAIL>
    <DIACHI>Soc Trang</DIACHI>
    <SDT>0933334444</SDT>
    <MALOP>L000003</MALOP>
  </SINHVIEN>

  <SINHVIEN>
    <MSSV>SV0000005</MSSV>
    <HOTEN>Vo Van E</HOTEN>
    <EMAIL>e@example.com</EMAIL>
    <DIACHI>An Giang</DIACHI>
    <SDT>0977778888</SDT>
    <MALOP>L000004</MALOP>
  </SINHVIEN>

</DSSV>
